{
  "schema": "jcc-game-knowledge-season-descriptor-v1",
  "logical_id": "season.s17",
  "scope": "season",
  "season_id": "s17",
  "inherits": {
    "common_manifest": "manifest.json",
    "standard_mechanics": [
      "mechanic.augment_choice"
    ]
  },
  "standard_mechanics_overrides": [],
  "mechanics": [
    {
      "id": "season_mechanic.star_god_choice",
      "choice_kind": "star_god",
      "candidate_count": 2,
      "candidate_authority": "current_match_user_report",
      "checkpoints": [
        "2-4",
        "3-4",
        "4-4"
      ],
      "requires_explicit_confirmation": true
    },
    {
      "id": "season_mechanic.stargazing",
      "kind": "match_variable"
    },
    {
      "id": "season_mechanic.encounter",
      "kind": "match_variable"
    },
    {
      "id": "season_mechanic.psionic_weapons",
      "kind": "equipment_extension"
    }
  ],
  "manual_variable_fields": [
    {
      "key": "encounter",
      "control": "single_select",
      "option_source_key": "encounter",
      "section": "primary"
    },
    {
      "key": "god_options",
      "control": "multi_select",
      "option_source_key": "current_god",
      "section": "primary",
      "max_items": 2
    },
    {
      "key": "stargazing",
      "control": "single_select",
      "option_source_key": "stargazer_constellation",
      "section": "primary"
    },
    {
      "key": "psionic_weapons",
      "control": "multi_select",
      "option_source_key": "psionic_weapon",
      "section": "advanced",
      "max_items": 2
    },
    {
      "key": "current_god_final",
      "control": "single_select",
      "option_source_key": "current_god",
      "section": "advanced"
    }
  ],
  "extensions": {
    "choice_pretriggers": {
      "2-3": {
        "target_checkpoint": "2-4",
        "mechanic_id": "season_mechanic.star_god_choice"
      },
      "3-3": {
        "target_checkpoint": "3-4",
        "mechanic_id": "season_mechanic.star_god_choice"
      },
      "4-3": {
        "target_checkpoint": "4-4",
        "mechanic_id": "season_mechanic.star_god_choice"
      }
    },
    "itemization_context_fields": [
      "confirmed_star_god",
      "psionic_weapons",
      "stargazing",
      "encounter"
    ],
    "retrieval_namespaces": [
      "star_god",
      "god_reward",
      "stargazer_constellation",
      "encounter",
      "psionic_weapon"
    ]
  },
  "season_entity_terms": [
    "star_god",
    "star-god",
    "god_options",
    "current_god",
    "stargazing",
    "encounter",
    "psionic_weapon",
    "psionic_weapons"
  ],
  "source_references": [
    {
      "role": "archived_normal_rule_source",
      "path": "data/game-knowledge/jcc/seasons/s17/archive-sources/legacy-runtime-rules/s17/normal-rules.json",
      "copy_policy": "hash_and_metadata_only"
    },
    {
      "role": "archived_special_rule_source",
      "path": "data/game-knowledge/jcc/seasons/s17/archive-sources/legacy-runtime-rules/s17/special-rules.json",
      "copy_policy": "hash_and_metadata_only"
    }
  ],
  "runtime_contract": {
    "schema": "jcc-season-runtime-contract-v1",
    "normal_rules": {
      "schema": "jcc-season-normal-rules-v1",
      "scope": "season_normal",
      "season_id": "s17",
      "patch_scope": "major_season_rules_not_patch_balance",
      "game_mode_id": "jcc-mode17",
      "display_name": "S17 normal rules",
      "choice_mechanics": [
        {
          "mechanic_id": "augment_choice",
          "kind": "augment",
          "mode": "augment_choice",
          "phase": "augment_choice",
          "label": "augment choice",
          "intent_terms": [
            "海克斯",
            "强化",
            "海克斯强化",
            "augment",
            "hex"
          ],
          "trigger_terms": [
            "augment_choice",
            "augment_choice_advice"
          ],
          "aliases": [
            "augment",
            "hex",
            "强化选择"
          ],
          "stages": [
            "2-1",
            "3-2",
            "4-2"
          ]
        }
      ],
      "choice_pretriggers": {
        "1-4": {
          "target_stage_round": "2-1",
          "kind": "augment",
          "mode": "augment_choice",
          "phase": "augment_choice"
        },
        "3-1": {
          "target_stage_round": "3-2",
          "kind": "augment",
          "mode": "augment_choice",
          "phase": "augment_choice"
        },
        "4-1": {
          "target_stage_round": "4-2",
          "kind": "augment",
          "mode": "augment_choice",
          "phase": "augment_choice"
        }
      },
      "stage_decision_tasks": {
        "1-4": "Opening checkpoint: use current pairs, shop, item components, HP, gold, and match variables to prepare the 2-1 augment decision. Do not over-lock a comp before the augment.",
        "2-1": "Augment choice is happening now. Rank the three visible augment candidates against current board/items/economy/user intent and answer keep/reroll directly.",
        "2-2": "2-1 augment is already past. If the final selected augment is unknown, ask the user what they picked instead of saying to wait for 2-1.",
        "3-2": "Second augment choice is happening now. Re-rank candidates using the confirmed 2-1 augment, current direction, HP, economy, and board strength.",
        "4-2": "Third augment choice is happening now. Favor immediate combat, cap, and survival/value according to HP and current comp commitment."
      },
      "stage_strategy_protocol": {
        "1-2_to_1-3": {
          "coach_goal": "Read opening drops, pairs, shop hits, and components. Give one compact opener direction when evidence changes.",
          "must_consider": [
            "pairs",
            "two-star chances",
            "item components",
            "early board strength",
            "match variables"
          ],
          "avoid": [
            "locking a final comp",
            "claiming the 2-1 augment is known before it appears"
          ]
        },
        "1-4": {
          "coach_goal": "Prepare the 2-1 augment decision from current board, shop, item components, HP, gold, and match variables.",
          "must_consider": [
            "can preserve win streak",
            "can loss-streak/economy",
            "component direction",
            "frontline/backline quality",
            "user target plan"
          ],
          "output_bias": "Say the likely augment preference class, not a final augment pick."
        },
        "2-1": {
          "coach_goal": "Answer augment keep/reroll now.",
          "must_consider": [
            "three visible augment candidates",
            "current board",
            "bench pairs",
            "item components",
            "HP",
            "gold",
            "user intent",
            "daily big-data priors"
          ],
          "required_answer": "Pick keep/reroll and explain briefly. Do not give generic transition advice instead."
        },
        "2-2_to_2-3": {
          "coach_goal": "Use the selected 2-1 augment if known. If unknown and relevant, ask what was selected.",
          "must_consider": [
            "selected 2-1 augment",
            "gold/interest threshold",
            "level/xp",
            "board strength",
            "shop pairs"
          ],
          "avoid": [
            "saying to wait for 2-1",
            "pretending observed candidates are the selected augment"
          ]
        },
        "3-2": {
          "coach_goal": "Answer second augment keep/reroll using confirmed first augment and current direction.",
          "must_consider": [
            "selected 2-1 augment",
            "visible 3-2 candidates",
            "HP",
            "economy",
            "board commitment",
            "items",
            "own HP and lobby pace from public/economy signals"
          ]
        },
        "4-2": {
          "coach_goal": "Answer third augment keep/reroll for survival, cap, or finishing direction.",
          "must_consider": [
            "HP danger",
            "completed items",
            "current comp",
            "user-confirmed scouting notes if available",
            "cap potential",
            "reroll/level timing"
          ]
        }
      },
      "host_model_invariants": [
        "For this active S17 ruleset, normal augment choices are at 2-1, 3-2, and 4-2.",
        "If future S18 normal timing differs, replace this season_normal file instead of changing base_game_rules."
      ],
      "missing_choice_followups": {
        "2-2": {
          "choice_stage_round": "2-1",
          "kind": "augment"
        },
        "3-3": {
          "choice_stage_round": "3-2",
          "kind": "augment"
        },
        "4-3": {
          "choice_stage_round": "4-2",
          "kind": "augment"
        }
      }
    },
    "special_rules": {
      "schema": "jcc-season-special-rules-v1",
      "scope": "season_special",
      "season_id": "s17",
      "patch_scope": "major_season_rules_not_patch_balance",
      "game_mode_id": "jcc-mode17",
      "display_name": "S17 special rules",
      "mechanics": {
        "decision_input_catalog": {
          "source_kind_exclusions": {
            "augment": [
              {
                "source_id": "170716",
                "name": "亚索的恩赐",
                "classified_as": "star_god_reward_internal"
              },
              {
                "source_id": "170717",
                "name": "韦鲁斯的恩赐",
                "classified_as": "star_god_reward_internal"
              },
              {
                "source_id": "170718",
                "name": "阿狸的恩赐",
                "classified_as": "star_god_reward_internal"
              },
              {
                "source_id": "170719",
                "name": "凯尔的恩赐",
                "classified_as": "star_god_reward_internal"
              },
              {
                "source_id": "170720",
                "name": "伊芙琳的恩赐",